{
  "version": "1.0",
  "task": {
    "title": "Link UX Gremlin evidence artifacts in reports",
    "goal": "Copy Playwright evidence attachments into .agent/evidence during UX Gremlin ingest and render linked, data-rich Markdown and static HTML reports.",
    "scope": "Only the ux-gremlin plugin reporting, ingest, results schema, examples, docs, tests, package metadata, and local guardrail artifacts.",
    "non_goals": [
      "Do not add remote artifact upload or external report hosting.",
      "Do not add JavaScript or remote assets to the HTML report.",
      "Do not change generated Playwright test semantics beyond evidence reporting support.",
      "Do not modify unrelated plugins or hand-edit marketplace.json."
    ]
  },
  "assumptions": [
    {
      "id": "A1",
      "statement": "UX Gremlin report and ingest behavior is centralized in one Node ESM script, so evidence copying and report linking can be implemented without introducing a new runtime or dependency.",
      "category": "repo_structure",
      "risk_level": "medium",
      "verification_method": "Read the plugin package metadata and ux-gremlin command script.",
      "evidence": [
        "plugins/ux-gremlin/package.json exposes skills/ux-gremlin/scripts/ux-gremlin.mjs as the plugin bin.",
        "plugins/ux-gremlin/skills/ux-gremlin/scripts/ux-gremlin.mjs contains commandIngest, normalizeReport, renderMarkdownReport, renderHtmlReport, and commandReport."
      ],
      "status": "verified",
      "files_checked": [
        "plugins/ux-gremlin/package.json",
        "plugins/ux-gremlin/skills/ux-gremlin/scripts/ux-gremlin.mjs"
      ],
      "commands_run": [],
      "impact_if_wrong": "The implementation could split behavior across the wrong artifacts or require new plugin infrastructure.",
      "decision": "Implement the feature in ux-gremlin.mjs and existing plugin tests/docs."
    },
    {
      "id": "A2",
      "statement": "The existing results contract stores screenshots and traces as string arrays and can be extended with evidence_artifacts without breaking current consumers.",
      "category": "data_model",
      "risk_level": "medium",
      "verification_method": "Read results schema, results template/example, validator, and report normalization code.",
      "evidence": [
        "plugins/ux-gremlin/skills/ux-gremlin/schemas/ux-gremlin-results.schema.json defines screenshots and traces as arrays of strings and allows additional properties.",
        "validateResults currently checks screenshots and traces as string arrays.",
        "normalizeReport preserves per-scenario screenshots and traces and aggregates them into report.evidence."
      ],
      "status": "verified",
      "files_checked": [
        "plugins/ux-gremlin/skills/ux-gremlin/schemas/ux-gremlin-results.schema.json",
        "plugins/ux-gremlin/skills/ux-gremlin/templates/ux-gremlin-results.yaml",
        "plugins/ux-gremlin/skills/ux-gremlin/examples/results.example.yaml",
        "plugins/ux-gremlin/skills/ux-gremlin/scripts/ux-gremlin.mjs"
      ],
      "commands_run": [],
      "impact_if_wrong": "A schema change could break existing reports or ingested results.",
      "decision": "Preserve screenshots/traces and add optional evidence_artifacts as a compatible extension."
    },
    {
      "id": "A3",
      "statement": "Playwright JSON reporter evidence is represented as per-result attachments that can be copied locally when an attachment path exists.",
      "category": "api_contract",
      "risk_level": "high",
      "verification_method": "Use Playwright JSON reporter shape documented in the current fixture conventions and cover attachment handling with a regression test.",
      "evidence": [
        "plugins/ux-gremlin/skills/ux-gremlin/examples/playwright-report.example.json models suites/specs/tests/results, matching commandIngest traversal.",
        "The implementation will add a fixture test with result.attachments entries containing name/contentType/path and assert copied evidence files."
      ],
      "status": "verified",
      "files_checked": [
        "plugins/ux-gremlin/skills/ux-gremlin/examples/playwright-report.example.json",
        "plugins/ux-gremlin/skills/ux-gremlin/scripts/ux-gremlin.mjs",
        "plugins/ux-gremlin/test/ux-gremlin.test.mjs"
      ],
      "commands_run": [],
      "impact_if_wrong": "Ingest could silently miss evidence attachments or fail to copy artifacts from real Playwright output.",
      "decision": "Collect attachments from every Playwright test result attempt and validate the expected shape with tests."
    },
    {
      "id": "A4",
      "statement": "Evidence links can be rendered safely by linking only local .agent/evidence paths and escaping labels and href attributes in Markdown and HTML.",
      "category": "security_or_permissions",
      "risk_level": "high",
      "verification_method": "Read current escaping behavior and add malicious artifact-name regression coverage.",
      "evidence": [
        "renderHtmlReport already escapes dynamic text through escapeHtml and has an existing test that rejects raw <script> output.",
        "The implementation will add tests for quote/script-containing evidence names and for relative links into .agent/evidence."
      ],
      "status": "verified",
      "files_checked": [
        "plugins/ux-gremlin/skills/ux-gremlin/scripts/ux-gremlin.mjs",
        "plugins/ux-gremlin/test/ux-gremlin.test.mjs"
      ],
      "commands_run": [],
      "impact_if_wrong": "Reports could introduce HTML injection or unsafe file links from untrusted result text.",
      "decision": "Render links through dedicated local-evidence helpers and keep non-evidence strings as escaped text."
    }
  ],
  "final_verification": {
    "commands_run": [
      "npm --prefix /Users/samroberts/Repo/SamMRoberts/agentic-engineering/plugins/ux-gremlin test",
      "npm --prefix /Users/samroberts/Repo/SamMRoberts/agentic-engineering/plugins/ux-gremlin run validate",
      "node /Users/samroberts/Repo/SamMRoberts/agentic-engineering/scripts/sync-marketplace.mjs --check",
      "node /Users/samroberts/Repo/SamMRoberts/agentic-engineering/plugins/assumption-killer/bin/assumption-gate.mjs check --root /Users/samroberts/Repo/SamMRoberts/agentic-engineering",
      "node /Users/samroberts/Repo/SamMRoberts/agentic-engineering/plugins/change-control-compiler/bin/change-control.mjs check --root /Users/samroberts/Repo/SamMRoberts/agentic-engineering",
      "node /Users/samroberts/Repo/SamMRoberts/agentic-engineering/plugins/change-control-compiler/bin/change-control.mjs drift --root /Users/samroberts/Repo/SamMRoberts/agentic-engineering"
    ],
    "tests_run": [
      "node --test test/**/*.test.mjs"
    ],
    "result": "passed",
    "notes": "UX Gremlin evidence copying, linked reports, static HTML readability, docs, metadata, package validation, marketplace sync, and guardrail checks passed."
  }
}
